,评论,得分,时间,点赞
1304," 想要见到一座城市最美的样子，无疑是傍晚黄昏时刻。在夕然而，作为匆匆来过又离去的游人，很难如当地人一般，去到那些犄角旮旯里，或者某些门槛较高的地点，静静守候日落时分的绝美。我要推荐的这三个地方的日落，绝对是零门槛。
 栈桥 以东。
栈桥绝对是老城区甚至是整个城市的标志。栈桥以西看日出，栈桥以东看日落，是我在询问当地朋友时得到的最多的回答。在栈桥以东，沿着漫长海岸线向 小青岛 方向走去，整条线都能看到红日缓缓落在这城市背面的景色。
费用：免费
亮点：准入门槛低，交通方便，近在咫尺。
不足：太阳的方向与栈桥稍微有些偏离，无法将栈桥与太阳同时拍下。

小麦岛
小麦岛作为青岛新晋的热门公园，这里是绝佳的拍照地点，也是绝佳的拍日落的地点。如果你能赶个早，这里的日出同样是很美的。
费用：免费
亮点：能拍到太阳落入整座城市的画面，作为前景的海面也相较干净。如果季节时辰能对上，还能正好拍到一轮红日落在妈祖圣像手中的画面。当然，拍日落时分的人像也是绝佳的。
不足：离市中心略微有一点点远。整个公园无任何基础设施，需西北干粮与饮用水。

 情人坝 
这里是三个观赏点中我最爱的一个。常常的堤坝延伸如大海的深处，远看是浩渺无边的大海，回头时兴旺发达的城市。堤坝的尽头，则是一座高高竖立的白色灯塔。夕阳西下之时，抓拍及时还能拍到落日下的点点帆影。
费用：免费
亮点：基础设施完备，海景餐馆、各类小店齐全。风景绝美，日落前拍大海，日落后拍城市夜景都是绝佳机位。
不足：由于是长长的堤坝，海风很大，日落后温度会骤降，得带好衣物。

除去这几个地方，稍微有些门槛或比较偏远的有观赏点有浮山、石老人海、 崂山 ，以及各种小岛",4.4,2020/09/19,3
1305,附近停车很麻烦，联系把车开到悦喜客来广场，停在商场地下，每小时4元，电梯上来直接就是大教堂，玩好之后可以步行大约十分钟去栈桥，这样方便很多，栈桥属于实地比图片还要美的地方，人确实很多，但是值得一去，路上有很多拍照片的，个人建议自己手机拍一下，因为他们拍了直接打印出来，不好就容易有纠纷，路上正好看到一起，做游艇的话可以直接去船边和船人谈价格，我最后是两大一小坐冲锋舟去最远的五四广场一共三百元，栈桥可以穿拖鞋去，因为旁边就可以下去玩水，还是很方便的,4.4,2018/08/22,1
1306,栈桥是青岛啤酒的标志，之前看这个地方评分不高，老妈说还是去一趟，去了还是对的，景色很好。我们6点多坐快艇从一号海滨浴场过去，在这提醒大家，快艇挺黑的，按人头算还是按一趟算，单程还是往返，大家要看清楚，开船的又是另一个人，很乱，倒是在栈桥上有个看着挺正规的码头，海水浴场那边简直了，我们仨开过来要了350。不过说实话体验乘船体验还是不错的，朝着夕阳的方向，路过小青岛，景色美，老妈的吓得呜哇乱叫，最后脸都紫了，吓死我了，我赶紧让船开慢了，结果上岸以后还说要再玩儿一次……栈桥上可以看到西边的高楼，有点像上海的外滩，远处小青岛的灯塔一闪一闪的，好看。趣味性来说，海水退潮了，很多小朋友都在石头下边翻螃蟹，我们也买了小桶下去摸了，找到几个蛤蜊。人太多，看好自己的孩子。还有必要提一下，栈桥地下通道里小二层有个串串儿锅，俩老板都是实在人，串串味道也不错。如果不想走远，可以那里吃个饭。,4.4,2018/08/09,1
1307,我们是在下午去的栈桥，栈桥风景很好，远处真的是海天一色啊，走在栈道上可以闻到大海的味道，还有很多海鸥在海面上飞，拿一些面包可以喂它们，海边很舒服，风很大，可以看到很远的地方缓缓行驶的货轮，沿着栈桥的长桥可以一直走到海里，栈桥的人也不是很多，在这里散步拍照很享受，但是海边的沙子比较粗还有些蛤蜊皮和牡蛎皮，可能会割脚，旁边有很多买纪念品和特产的小摊位，但是价格都比较高，东西的质量看起来也不是很好，不如去台东步行街的某人特产铺子里买伴手礼，鱿鱼丝崂山绿的质量很好，还有一些很难买到的啤酒酥和黑蒜特别好吃。提醒一下，海边的快艇之类的项目不要去坐，不安全，而且价格很贵好几十块钱仅仅是在海边兜一圈，船速也很慢，体验很不好。。。。,4.4,2018/07/19,1
1308,栈桥也太棒了吧！海边的木栈道很长，维护的也都非常的好，景色也真的是很美啊，青岛的天很蓝，海水也很清澈，最惊喜的是，没想到能够在栈桥上看 到 海 鸥 ！ ！ ！真的很漂亮，还和孩子一起在路边买了面包，用面包屑喂了很多海鸥，栈桥的沙滩很细，卫生环保做的很好，可以看出来是有专门的保洁阿姨负责认真打扫的！几乎没看到网上说的水瓶竹签什么的，孩子也很喜欢在海边堆沙，吵着第二天还要来呢！但是海边的那些小商贩真的很坑人！！！不仅纪念品什么的谜之昂贵，连一瓶矿泉水也要贵好几块！所以买纪念品还是不能在景区买啊！推荐下前两天去台东买的店吧，也是在攻略上看到某人特产铺子，东西又好又便宜，所以就不要在栈桥边上买了！不过话说回来栈桥和崂山真的是印象最好的地方了，来青岛旅游的朋友们一定不要错过！别的景点人就比较多，但栈桥崂山都超级棒！,4.4,2018/07/15,1
1309,"青岛是一座碧海环绕、绿树掩映和红瓦点缀的美丽的现代化海滨城市。
      畅游青岛、美景不断，有充满历史感的人文建筑，有风景如画的自然景观，还有一座座讲述历史的博物馆......
      青岛栈桥，是一座被赋予恒久象征意义的城市码头，八大关景区，古树参天，四季鲜花常开，造型别致的欧式别墅群错落其间，江苏路基督教堂是青岛环境最优美的教堂，还有圣保罗教堂，红色的墙面在晨光中显得十分艳丽......
     最吸引游客的还数海水浴场，踩在细软的沙滩漫步，吹着海风，拥抱大海，在和谐的欢声笑语中享受悠闲的时光......
      当然也不能错过青岛的美食，在品赏美食中更忘不了青岛特产-碑酒，来释放你的激情......",4.4,2018/05/01,1
1310,免费的，回澜阁限定人数参观，不过去的人不多。那里的海水比岸边好多了。停车我停火车站南侧，神州租车的那个停车场，8元一小时，一般来回不超过两小时。青岛的标志，因为不要钱。所以值得一去,4.4,2017/06/24,2
1311,栈桥应该是去青岛旅游必去的一站，从火车站出来步行5分钟就到了，长长的海岸线，一望无际的大海，整个人都得到了放松，如果走累了可以在附近找公交车坐着欣赏，很多公交车都沿海岸线走，票价大都是一块，很方便，但附近吃的和工艺品不推荐，吃的略贵，工工艺品没什么价值。,4.4,2016/10/12,3
1312,栈桥是青岛标志性建筑物，但是我们是早上快9点去的，已经特别热了，而且人也很多了，沙滩和礁石上到处都是捡贝壳的人，自然风光没有好到那儿，回澜阁里也是走马观花的看了一圈，讲的是栈桥的历史，而且千万不要从地下通道过马路，通道里全是卖东西的，浓浓的鱼虾味儿，反正我是闻不惯，再往麦当劳的那个方向走走，会有人行横道,4.4,2016/08/06,3
1313,青岛的地标，不是值不值得去，一定要去。景色很震撼！近处就有一处船港，好像还有军舰。好多人喂海鸥。还有寄明信片的邮政服务点。进阁楼是要收费的。,4.4,2015/11/10,2
1314,推荐大家去的地方，最好不要在节假日去人太多，人少的话去最佳！,4.4,2015/09/07,0
1315,海浪，沙滩，游泳，歌曲演唱，漂亮的夜景，美丽的贝壳饰品………,4.4,2015/08/24,0
1316,风景不错，站在中间的塔上可以看到远处的帆船。去边上玩个摩托艇是不错的选择。退了潮，去岩石缝里逮点小螃蟹，捡点美丽的贝壳和野生的紫菜。很棒的！,4.4,2015/07/15,0
1317,周六上午到的栈桥，到了那有很多拉客出海的人，虽然有停车位，但都是停在路边的，因为在那边要待两天，不放心停路面，怕贴单，绕了一圈，发现青岛日报社的地下停车场双休日是对外开放的，停两天才给10块。那边海水很清澈，比夏天干净很多，还看到有几个冬泳的老大爷，真是厉害，这个天气我穿件大衣都觉得冷，捡了很多漂亮的石头和贝壳，被路边几个卖贝壳链的大哥大姐缠得没法，买了几条，不过很便宜，两块。路边的铁板鱿鱼很好吃，跟家里的味道不一样你哦,4.4,2014/11/06,1
1318,前段时间有很多海鸥，可以说是非常壮观了,4.4,2019/01/18,1
1319,可以去走走，要拍照的的话，建议还是不要走近了！拍的都是人头,4.4,2018/10/07,0
1320,友情提示下，其百度导航的停车场离海上的回澜阁还有1公里多。不过沿着停车场附近的堤坝步行，远观栈桥却别有一番风味，还可以近看海军博物馆旁边的军舰和潜艇，不错哦！,4.4,2018/04/06,3
1321,栈桥是青岛一个很重要的景点，到青岛火车站很近，步行五分钟！栈桥有一定的历史意义，据说是以前德国的军队的海上码头！这里每天人都不少，风景优美，海水清澈，空气质量高！很适合周末游玩！,4.4,2017/09/09,2
1322,青岛的地标建筑之一，一出火车站就能看到栈桥，是旅行者到青岛后的第一个景点，历史与现代的完美结合，前面是一望无际的大海，背面是青岛中央商务区，栈桥旁边是海水浴场，可以游泳和捡拾贝壳,4.4,2017/08/20,2
1323,栈桥，当年结婚的时候在青岛度的蜜月，也曾在栈桥捉过螃蟹️，现在一晃闺女都上初二了，再来栈桥，感觉周围的建筑变化不大。是一个适合拍照的地方。,4.4,2017/02/16,2
1324,风景不错，不要门票，人挺多，旁边可以做快艇，基本是乱要价，买票时看似明码标价，买了票坐船前又加100，要不然必须凑人，上了船又忽悠加200带看军舰，不去就一直问你，但也不会强迫你,4.4,2016/10/07,2
1325,很不错，我跟女友都很喜欢。以后有机会的话，我想跟我的家人一起来，这次是一次说走就走的旅行，感觉很爽，只是附近住宿问题有点困难，需要提前预定,4.4,2016/08/03,2
1326,第一天去栈桥的时候海浪太大直接封了，只能在岸边看看，第三天再去的时候就能上去了，这段时间青岛的天气不好，能见度很低，好在这大部分的景点都不收费，收费的也都很便宜，几块或者头十块。,4.4,2016/07/26,2
1327,非常美的经典景色，站在那会想起自己小时候来过的场景，希望这里永远都不要变，美丽的风景和辽阔的海面。交通十分便利，就在火车站旁边。很多海鸥。,4.4,2016/04/14,2
1328,去青岛必备打卡点，离火车站很近，我个人觉得一般现在好去处太多拉，下边是第一海水浴场，水质是最差的,4.4,2019/07/04,0
1329,还可以吧，天气好的时候海很蓝，还有人在跳水，海里还有石头可以下去拍个照什么的是个好地方，还有坐游艇，还能讲价的，50元两人，不过小孩用票,4.4,2016/10/09,4
1330,晚上去的栈桥，很多人在旁边沙滩上玩耍。可能晚上比较安静的原因，海浪拍打在岩石上的声音特别清晰，很有海边的感觉。栈桥实在是不算长，即使游览人数不算多的晚上，还是让人觉得太拥挤了。,4.4,2015/10/04,0
1331,每次到栈桥看到这么多的人，都眼晕的感觉，还要排着队，然后一步一步往前进，最喜欢冬天的栈桥人比较少，而且还有海鸥，那样的栈桥才更有魅力。,4.4,2019/08/21,0
1332,下了火车站就是栈桥，看着还是挺漂亮的，一直延续到海的大里边，顺着栈桥一直走，看看海的风景确实很美，只不过平时人非常多很难有人少的时候。,4.4,2019/08/21,0
1333,青岛地表级建筑，一条长廊探入大海，静静地守护着这座美丽的城市。附近可以沿着海滩走走看看，美哉。,4.4,2019/06/23,0
1334,青岛确实是个不错的地方，栈桥作为标志景点之一，又是不得不来的地方。走到桥的尽头，远眺海面，风景相当不错，有没有门票，性价比不错。看完栈桥去海边浴场游泳，去教堂，八大关都很近。,4.4,2018/12/26,0
1335,去的时候浪很大，栈桥没让游客上去，只是在岸边观看了，好像挺不幸的，每天天气都不是很好，但庆幸没下很大的雨，拍出来不是很漂亮，但是足够用眼睛观赏了，很知足了,4.4,2017/10/07,3
1336,青岛，一座美丽的海滨城市！空气很好，城市也很悠闲！漫步于栈桥海滨，可观看海鸥在此自由翱翔，眼前大海尽收眼底……吹吹海风，很惬意的享受！,4.4,2017/04/29,2
1337,一个上午两个多小时孩子都在桥下抓螃蟹，去看了回澜阁，很有意义，虽然不大，但里面很详细的记载了青岛的历史，值得一看！,4.4,2016/08/10,1
1338,栈桥边，脚踩礁石，听着海浪声。眺望海的那边…惬意！,4.4,2015/10/21,0
1339,在海边的景点应该很美！但是人实在太多了！没勇气继续前行,4.4,2015/10/08,0
1340,人特别多，沙滩也不错，还可以抓小虾小鱼，小朋友特别喜欢,4.4,2015/09/20,0
1341,来青岛不能不去的一个景点，长长的栈桥直伸向海中，尽头是回澜阁，建筑雄伟。在这里可以观海听涛。,4.4,2018/09/16,0
1342,这里是青岛标志性景点，靠近青岛火车站，如果离乘车还有一个小时的时间，可以顺便去看看 这个季节很多品种的越冬海鸥在海边翱翔，会让你让你有亲近大自然的美好享受,4.4,2017/11/27,3
1343,因為出差的緣故，公司訂的酒店是王子酒店，靠近棧橋，所以一早就去海邊走走。當然當天的天氣比較一般，海水的味道腥味較重，但是人却不是很多，也比較安靜，沙灘不建議下去了，有點脏。,4.4,2017/08/07,2
1344,假期去人会很多，不过景色很美！尤其傍晚的时候，和爱的人一起散步海边看夕阳是一种特别幸福的享受！温馨而又甜蜜！当然，如果人少些会更美！,4.4,2016/10/06,2
1345,孩子在栈桥的海边玩的真叫一个高兴，我们特意抽出了一下午时间让他在海边感受阳光，蓝天，沙滩，大海，小家伙开心的不得了，根本停不下来呀。,4.4,2016/07/07,4
1346,环境不错，海风吹的很爽。很有韵味。和好哥们一起去的。,4.4,2015/08/31,0
1347,晚上来的栈桥，海风吹得很凉快！青岛的夜景也是不错的！,4.4,2015/07/01,0
1348,风景挺好的，玩儿的倒是没多少，海水很干净空气很清新。,4.4,2015/05/08,0
1349,栈桥风景还不错，我们去了也没花什么钱，就是纯溜达，五一的时候还是有点冷，不过水很干净，去溜达溜达还挺好，那边还有坐船去各个地方的。,4.4,2018/09/21,0
1350,早上去的，看看海，吹吹海风挺好的，很适合看海景，不过没有什么可玩性，主要是看景，地方不大，也就百十来米长，下面有个小沙滩，不过沙滩还是去海水浴场玩的好,4.4,2017/05/03,3
1351,青岛的地标性建筑必须去看看，海风轻抚海水清澈，人还是蛮多的，退潮时可以下海滩走走但是要记得带水冲脚哦！栈桥靠海底世界，海军博物馆及八大关很近，可以考虑顺路一起玩不用重复！,4.4,2016/07/30,2
1352,就在中山路南端路口，离火车站也进，年费的，不过登那个小楼要花钱的，好像4块，提醒完全没必要登那个楼且即使登了也不要相信二楼免费洗照片，因为大叔说了，他赚得就是最后的琐边费,4.4,2016/01/02,2
1353,闲来无事去吹吹海风还不错春末夏初最好了冬天还是乖乖呆在家里吧。海水不是很干净抓了好多小螃蟹,4.4,2015/12/26,0
1354,栈桥是青岛地标性建筑，位于中山路南端，离火车站只有一站路，处于青岛西部老城区，真的是红瓦绿树碧海蓝天，好多欧式建筑，回澜阁很漂亮。,4.4,2015/11/15,2
1355,大海，很美，海滩很干净，美食也可以，青岛人也很热情,4.4,2015/08/08,0
1356,风景优雅，沙滩干净细腻，是疗养身心，休闲的好去处！,4.4,2015/03/15,0
1357,这是青岛的必打景点。清晨可以在这里看日出，这里就是一条栈道伸到海中，可以近距离接触海鸥。,4.4,2019/07/01,0
1358,如果不是和当地人聊天 还真的想不到栈桥竟然已经有百年的历史了 这应该就是所谓的地标性建筑了吧,4.4,2019/06/05,0
1359,栈桥是青岛的地标，是很多外来游客的首选，一直非常不错，特别喜欢栈桥这个旅游景点，很喜欢。,4.4,2019/02/27,0
1360,这里的景色是海滨类中最美的，周围有山峦围绕，中间的栈桥亭子等，还有众多的海鸥飞翔，沙滩大海，蓝天白云，那美丽景色非笔墨可以描述。,4.4,2017/08/17,2
1361,这里的景色非常漂亮，跟家人体验一次快艇，太刺激了,4.4,2015/06/09,0
1362,离火车站很近，坐高铁出站后，步行二十多分钟就可以看到栈桥了，延伸至海里，有一个小亭子。,4.4,2018/09/29,0
1363,"去青岛怎么不去栈桥看看，
夏天的青岛很凉爽，吹吹海风，真过瘾。
人很多，海很蓝，稍微遗憾的是没有太阳，感觉潮潮的，有点阳光就好了！",4.4,2018/07/17,0
1364,栈桥，算得上是青岛的一大标志性建筑，虽然进到楼阁里没多少东西。但是远观却非常的漂亮。青岛的海太美了。免费领取参观卡进入，到了青岛还是应该去看看的。,4.4,2018/05/22,1
1365,今天去了，因为住在火车站附近，所以化了10多分钟就走到了，国庆节人很多，堤岸上都是人，昨天下了大雨，今天风大浪大，栈桥封掉了没能上去走走，可惜了。,4.4,2017/10/01,3
1366,青岛游必去的免费景点，从照片上就能看到恐怖的人潮。我们去的那天，时间差不多傍晚了，栈桥上走到头，只有一座红房子，至今没弄懂这是个迴什么阁，回来正好赶上日落，顺手拍了张,4.4,2016/12/14,2
1367,不错，五一假期人超多，尽管海水很凉但是依旧挡不住孩子们下水的乐趣。白天和晚上分别来了一次，白天人多，晚上风大，但是夜景很漂亮。,4.4,2016/05/01,2
1368,也不花钱的地方，老牌的青岛旅游景点了。建议去。,4.4,2015/09/27,0
1369,青岛是个不错的城市，8月份来天公作美，风景如画,4.4,2015/08/19,0
1370,很美很好看，淡季，晚上去人少另有一番别样风景！,4.4,2015/06/26,0
1371,站着回澜阁的，眺望远处一望无际的海边，孤立的小岛，蔚蓝的天空，波光粼粼的海面，不远处几只船泛泛而行，成为一到美丽的风景线，，，,4.4,2015/06/04,0
1372,但是如照片，其实人也不少，我也是很汗颜啊，但是不至于没处落脚那么夸张，走到栈桥的尽头的时候，就像站在一望无际的大海中央领略大海的浩瀚，没有词汇形容了，就一个字吧！美！,4.4,2014/11/25,0
1373,青岛的标志性建筑之一了，深入海中的回澜阁也是青岛啤酒的商标。免费景点，每天人多的要命,4.4,2019/06/02,0
1374,不收费！下午的飞机，上午来到这里，简直是惊艳，人不多，海边很干净，视野开阔，拍照的极好地方。还有军事博物馆，舰艇，强烈推荐！,4.4,2016/09/24,2
1375,虽然就是一个桥，不过早上去感觉特别好，人挺多，站在亭子旁边望望海，有种特别幸福的感觉，早上去散散步挺好的，不过就是停车费太贵,4.4,2016/07/30,2
1376,回澜阁今年五一开始免费参观，限制人数！去崂山拼车小团，找驴歌，不一样的旅行体验！栈桥像北京天安门上海外滩一样是青岛必游之地！,4.4,2016/05/05,2
1377,海鴎漫天飞舞盘旋著餵食的人，吱吱呱呱，好不熱鬧，胆子大的，甚至会悬仃在面前等食物抛出。一元一小包面包粒，餵完再买，太开心了！,4.4,2016/01/22,0
1378,这里夜景真的很美，西望东顾有动的璀璨也有静的优雅，海风轻轻拂面涛声阵阵耳边……最主要离火车站太近，临走顺道就观赏了，赞一个！,4.4,2015/11/06,2
1379,还可以，晚上去，风景不错，人有点多，海风不错,4.4,2015/10/05,0
1380,海边真是美美的，还抓拍了不认识的美女哥帅哥。,4.4,2015/10/04,0
1381,住这边，交通便利，附近景点很多胶澳督府旧址，德国、英国领事馆旧址，英国神甫旧居，海军博物馆，德国监狱博物馆都很近，走路可解决,4.4,2015/07/05,0
1382,沙鸥很美 海风很清新 我很清醒 美丽的城市 欧洲范儿,4.4,2015/02/22,0
1383,代表性的青岛著名景点，长长的栈桥，尽头是回澜阁，涛声伴着咸咸的海风，来青岛必打卡！,4.4,2019/07/03,0
1384,记得那年去栈桥，当天还下着雨，朦朦的，细细的，孩子不要任何雨具，在海边玩的自由自在,4.4,2018/09/20,0
1385,地方不大，最多一小时就能走完，但海真的非常来阔。有个塔可以免费参观第一层（上面不让走上去），还可以看看旁边的房子，很漂亮。,4.4,2017/11/21,2
1386,来青岛怎能不去栈桥，这不是啤酒上都有的标志，我是夜晚去的，站在栈桥上能感受到海浪的翻滚，看到岸边的景色，很美。所以值得去。,4.4,2017/08/06,2
1387,不需要门票，景色很棒。蓝天碧海，一望无际。今天有些涨潮，看着海水一阶一阶没过，心里很平静。海风吹着很舒服，如果人不是那么多不那么吵杂的话会更好,4.4,2017/06/25,3
1388,青岛的象征！海风，美景，让人心旷神怡！不虚此行。海欧在你眼前尽情的飞来飞去……最美好的时光驻足在栈桥，享受大海的美丽风情。,4.4,2017/04/06,4
1389,"风景很美丽啊
早上七点出发去栈桥军事博物馆海底世界一直在行走中度过也不会觉得多累了",4.4,2017/04/03,2
1390,在栈桥我留下了很美好的回忆。当时是和两个舍友来毕业旅行，一天的行程结束之后，晚上在海边散步，也没有看地图，无意中就走到了栈桥。站在桥上，看着大海，有不一样的感觉。,4.4,2016/10/12,2
1391,景致很美，说是青岛地标，确实不错！只是天太热，人太多，海水水质不差，很多中老年人就在栈桥跳水，成了一道别样的风景，赞一个！,4.4,2016/08/16,2
1392,风景不错，我们早上到的青岛，就直接去了栈桥，人还不是很多，也不少吧，很凉快，海风吹着带着淡淡的腥味，神清气爽，总之，不错！,4.4,2016/07/04,4
1393,栈桥就是一个建在海面上的桥，走到头有一个小的景观点，但是他可以说是青岛一个地标性的建筑物，据说是先有的栈桥才有的青岛，所以对青岛人们来说很重要,4.4,2016/06/14,1
1394,一个人的旅行。很舒适很自由。即使陌生还是选择自由行。下了飞机第一站去的就是栈桥。人山人海，形形色色的人，我就这么被吸引住了,4.4,2016/06/08,2
1395,不错的经典，能代表青岛的特色，海边风景很美,4.4,2016/01/19,0
1396,非常不错的地方，习惯了在海边想事情，沉思，,4.4,2015/11/01,0
1397,还行，见面不如闻名，好在不要钱，可以看看。,4.4,2015/08/10,0
1398,栈桥还是挺值得去的，景色很美，台风利奇马过后，有很多人来这儿捡贝壳，孩子们挺开心,4.4,2019/08/13,0
1399,还是值得去看一看的，第一次去是在晚上，感受到栈桥夜景的美及周围高楼大厦的宏伟气势，顺着栈桥往里走就到了回澜阁，人很多，都在那里拍照留念，逛一圈，感受海风阵阵，游人如织，非常热闹，全程走下来一点也不累。第二次去是在中午，人依旧那么多，我们下到海边，海浪此起彼伏，凉风习习，真的是太惬意了！岸边有很多人在抓小螃蟹，小虾等，我们也开始抓，很好玩，小螃蟹很小很可爱，只有米粒那么大，抓完之后又把它们都放回海里，然后就走了，海边虽然凉爽，但是却容易晒黑，即使是没有太阳☀，也会晒黑，所以一定要做好防晒。,4.4,2018/08/05,0
