,评论,得分,时间,点赞
613,"这是来青岛的第四年了，每年这个时候都会来栈桥这边，喂海鸥，拍海鸥，感觉今年的海鸥肥了不少，可能是吃的太多了吧！简单说一下我是怎么拍照，怎么喂海鸥的！
拍照注意事项：
由于海鸥是动物，不可能待在那让你拍，所以相机尽可能的打到自动挡或者快门优先模式，快门速度快才能保证拍摄的质量，快门速度过低要么捕捉不到好的画面，要么画面模糊！一定要用连拍模式！用手机拍摄的小伙伴反应一定要快！
投喂注意事项：
从家带点馒头、面包、油条、大饼啥的就可以，投喂的时候块撕的稍微大一点，以便于扔的远一点，如果在手里喂食尽可能早点去，有手套带好手套！
安全事项：
注意海水涨潮，不要被困在礁石上
总结一下，栈桥这个位置很方便，青岛站出站就到，周边住宿交通也都比较方便，现在海风还是挺凉的，适当增加衣物！
有想来青岛旅行的小伙伴，不知道怎么玩的，可以私信我！",4.4,2021/02/28,0
614,"青岛不光有沙滩、阳光、海鲜、啤酒，青岛还有许多人文景观。
一、总督楼，青岛近代建筑的经典之作——德国胶澳总督府（官邸旧址》德国胶澳总督府（官邸）旧址坐落于青岛市南区信号山南麓，龙山路26号，与信号山公园南门相邻，进门是一条林荫大道，通往总督府（官邸）旧址。这幢青岛最美的西式建筑没有围墙，是具有欧洲皇家风范的德国古堡式建筑，始建于1905年10月，由德国建筑师马尔克设计，于两年后建成。青岛古称胶澳，这座富丽堂皇的德式古堡是当年德国占领胶澳地区后总督的官邸，故俗称“胶澳总督府（官邸）或“总督楼”。图1~3。
位置：青岛市市南区龙山路26号。
交通：公交，乘220路空调公交车在龙口路站下车；
或乘217、220空调、221路公交车在龙江路站下车，步行约200米可达 。
乘地铁三号线到人民会堂站下车
二、栈桥，建于1892年清光绪年间，目前是青岛的标志之一。图4~6
位置：青岛市太平路12号
交通：地铁3号线青岛站下，步行450米。
三、信号山，俗称“挂旗山”，位于老城区的中心位置，山顶上三个不同高度的红色蘑菇楼，寓意我国古代传递信号的三支红色火炬。信号山并不高，登顶大概需要10分钟左右。站在半山腰的观景台上眺望时，真真切切地感受到了“红瓦绿树碧海蓝天”之美。在这里不仅能拍到基督教堂和总督府的全貌，还能拍到远处大海上的栈桥和小青岛。图6~8。
位置：青岛市市南区齐东路17号丁
交通：乘坐地铁3号线「人民会堂站」B口出，步行880米。
四、德国建筑群
1897年德国政府借口曹州教案派兵强占胶州湾后，在青岛市留下德国人建的西式建筑群。如1905年建的德占领军提督府，建于1908年的基督教堂，还有青岛邮电局、青岛监狱、八大关别墅群等哥特式、古堡式、罗马式建筑。图9~16。
位置：分布广可结合其它景点一起游览。
五、海拔零点
中国零点景区是青岛新型的旅游景区。内设中国唯一的中华人民共和国水准零点、中国第一个国际游艇帆船产业发展基地、世界最高的“海上妈祖女神”雕塑、世界第一座可机械开合的海上彩虹桥、帆船之都观光塔以及航海科技博物馆。
 景区位于青岛浮山湾东侧，是国家AAAA景区。图17~19。
位置：青岛市市南区东海中路30号银海大世界
交通：市内乘225路环线、231路环线、232路环线、317路、504路、旅游1号线等公交车在银海游艇俱乐部站下车步行约200米可达。
六、《五四广场》和奥帆中心
《五四广场》和奥帆中心毗邻，2008年在这举行了奥运帆船比赛。两者由原北海船厂改建，现在看不出一点船厂的痕迹，夜景非常漂亮。图20。
位置：青岛市市南区香港中路南50米
交通：317路 、 504路 、 601路环线 、 都市观光1线 、 观光3路环线 、 旅游1路 、 旅游3路环线。",4.4,2021/02/26,0
615,"青岛的栈桥大概是每个来青岛玩的小伙伴都会去的第一站，冬季的栈桥有一番特别的景象，那就是每年会有大约10万只海鸥会从西伯利亚飞到这里过冬！
	
海鸥一般会出现在每年的10月份到次年的4月份左右，入冬以后的青岛是旅行的淡季，这个时候来青岛玩不仅人少，住宿比较便宜，而且景色也别有一番风味～非常适合新年旅行！
那么重点来了！！！如何才能给女朋友拍出好看的照片呢！？
	
整理了几个小小tips:
海边会有人卖喂食海鸥的东西，一般都是馒头、油条等，价格很便宜，当然大家如果方便的话也可以自己带一些面包之类的～
比较推荐的拍海鸥时间，上午的9点到11点，下午的3点到5点，这个时候光线比较好，选一个天气好的时候去海边，下午还能拍到夕阳！
一定要多多的抓拍，也可以设置一下连拍，拍人物的时候可以多选择拍摄侧面和背景，有条件的小伙伴就带个专业点的相机，可能成片率会相对高一点
退潮的时候可以避开桥上的人群，到海滩礁石上去，这里海鸥会更密集一些，但是一定要注意安全～
冬天的青岛气温还是很低的，海边会更冷一些，来玩的小伙伴在美丽的同时也要做好保暖！
每年的冬天都会有很多人特意跑去海边拍照，这群飞跃千里的小海鸥们让青岛这座本来就很美的城市在这个季节里多了一份浪漫和温情，欢迎大家随时来青岛玩～",4.4,2021/02/26,0
616,"去青岛一定要做的20件小事
1. 打卡青岛旅游地标 栈桥
2. 晚上去五四广场看灯光秀
3. 小麦岛公园最美海边野炊,姐妹们的聚会一起野餐打卡
4. 去小鱼山公园俯瞰一次青岛老城
5. 去青岛啤酒博物馆解密青岛啤酒的生产过程
6. 情侣要去一次情人坝站点手牵手看大海
7. 黄岛金沙滩游泳玩沙,遇上啤酒节嗨一场
8. 去看看德国监狱旧址博物，馆目前保存最完整的殖民监狱
9. 去海军博物馆馆参观核潜艇和军舰
10. 去看看青岛市美术馆的复古文艺风
11. 打卡花石楼,花岗石砌成的外墙,很有特色
12. 去石老人网红石洞看海上日出
13. 到台东步行街吃一次小吃
14. 去打卡大学路的网红转角
15. 带着喜欢的人一起打卡琴岛之眼摩天轮
16. 参观一下丹麦公主住过的八大关风景区-公主楼
17. 去浙江路天主教堂，中国唯一的祝圣教堂
18. 去王姐烧烤（中山路店）唯一一家真店尝尝特色烧烤
19. 去金麦园尝尝青岛老字号面包
20. 住在青岛的海边民宿，享受浪漫时光",4.4,2021/02/26,0
617,"你大概从没想到，夏天挤的水泄不通的栈桥，到了寒冷的冬季依旧是人山人海的模样吧。这是为什么呢？原来，从遥远的西伯利亚飞来的海鸥每年冬天，都会在青岛过冬，躲避了老家的严寒，顺便在温暖的海边 “度个假”。就是这群聪明的小家伙，让原本冷清的栈桥，又热热闹闹起来了。
抓紧去呀！春暖花开的时候它们可就回老家了…
 
【亮点特色】

晴空万里的日子，栈桥是真的很美好呀！那些划过海面的快艇呼啸而过，激起层层波纹，高楼之下便是碧海蓝天，这是和青岛有关的度假记忆。走在栈桥上，可以看远处的红房子。似乎，这是很鲜明的青岛色彩。
 
红瓦绿树，碧海蓝天，这是康有为先生对青岛建筑与环境和谐统一的传神描绘也成为青岛城市形象的生动写照。青岛所特有的地形、气候、文化、历史特点使得该地区形成了有着与西欧德式建筑特色相融合的建筑风格。
 
海鸥让这座充满色彩的城市又多了几分灵动。而且海鸥特别喜欢吃类似于烧饼、油条的食物！海鸥是相当聪明的，他们知道只有跟着有饼的人才有吃的。
 
要想玩的快乐，抛出食物逗引他们的时候，可以一个一个的往上抛，这样海鸥才可以吃到。对于没有经验的小伙伴，经常一大把抛出去了，可惜海鸥真正吃到嘴里的并不多，很多食物就造成了浪费。
 
蓝天白云下，这些小家伙们相当欢快，还会发出吱吱吱的叫声，大概是吃的非常开心吧。

𝘐𝘕𝘍𝘖

详细地址：山东省青岛市市南区太平路14号
交通攻略：乘坐2、5、6、8、25、26、218、220、223、225、301、304、305、307、311、316、320、321、501、217、801等路公交车在栈桥公园站下车。
开放时间：全天
门票价格：免费",4.4,2021/02/22,0
618,风景绝佳，一步一景，蓝天白云，海天一色。,4.4,2021/02/07,0
619,值得一去的地方，当时还住在对面的栈桥酒店,4.4,2020/11/19,0
620,有趣好玩，值得推荐，,4.4,2020/09/13,1
621,值得一去的值得推荐，,4.4,2020/08/31,1
622,是青岛标志性建筑之一，每天都有很多人到这里来玩，还是不错的。,4.4,2020/07/24,1
623,青岛标志性景点，虽然历经沧桑，几经修整，但它承载着青岛的历史,4.4,2020/04/17,1
624,冬天的话也就走走看看海，但是千万不要相信那些说拍照的10块2张10块3张什么的，根本不是那个价格，都是按冲晒的尺寸收费，过索封装另外收费，加时间等字又另外收费，总之价格巨贵，晒出来的照片质量还不咋样，，唉，第一次来这里，就当交学费了,4.4,2019/11/14,0
625,"依稀记得是信号山公园出来后去的栈桥吧？这是一段曾和白眼狼出游的时光，所以记忆不深刻了，众多共同认识的朋友都叫我不要再理它了，本来就是我把它带进圈子，要让大家都知道那副嘴脸是很容易的事情。
    言归正传，栈桥很漂亮，还有大爷大妈在那里跳水游泳，喜欢海边，青岛总会再去，",4.4,2019/02/27,0
626,去的时候已经快傍晚了，但是人还挺多的。虽然只是在海面上造了一座小亭子，风景却别具一格，有独特魅力。走在长长的的桥面上，看着四周的风景，心情很舒畅。走到小屋，可以进入参观，里面有简单的历史介绍。围绕小屋走一圈，看看周围现代的建筑，会感叹很多地方发展越来越好。,4.4,2018/12/19,0
627,"栈桥有着一百多年的历史，回澜阁与小青岛隔海相望，是青岛的重要标志。回澜阁可以凭窗眺望，有“一窗一景，一景一画”之说，全方位地看到美丽的青岛湾和周围的各个景点。我从五四广场坐公交过来用了大约30分钟，晚上的海风非常的大，没想到夏天的夜晚也这么凉，吹得我瑟瑟发抖。早晨的栈桥和夜晚大不相同，比夜晚热闹许多。一大早就好多人，还有很多商家在推销他们的游玩项目。有潜水、摩托艇、快艇等游玩项目。沙滩上有捡贝壳的、踏浪的、还有打排球的，海滩上处处充满了生机。

Tips：
【门票】免费
【地址】市南区太平路14号
【交通】乘2路、5路、6路、8路、25路、26路、217路、220路、223路等均可到达",4.4,2018/11/12,0
628,栈桥是青岛的标志之一。从栈桥向两边望去，小青岛、海军博物馆都尽收眼底。这次到青岛玩，正好就住在栈桥边上，天天都要到栈桥来溜达一趟，不管什么时候来，都是人流密集。白天选择好了退潮的时间，孩子拿着小桶、小铲子就到海边挖蛤蜊、捉小鱼小虾。晚上到海边，更是人潮涌动，赶上海边灯光秀，海风吹拂，灯光璀璨，美轮美奂。,4.4,2018/11/08,0
629,"岛上下坡很多，城市建筑也比较好，但是不如大连。映入我的眼帘的就是我的同事季铭忠姐姐的大标语──“打倒季铭玲”，真是位出名的人物，挺可笑的。
大海又一次以它的巍然大观感动了我，蔚蓝色的大海使人痛快，有一种说不出来的幸福感。大海用她的波浪抚摩着大地，每个人都能沉醉在这和谐的大自然的怀抱之中。
我坐在海边，吃着青岛产的苹果，在海浪的拍打声中，度过了几个小时，又一次恋恋不舍的离开了朝思暮想的大海。",4.4,2018/10/23,0
630,不错不错非常值得一看的地方，不虚此行。,4.4,2021/02/04,0
631,风景很美，景色不错,4.4,2020/10/04,1
632,每个节假日都是人头攒动，人流量非常的大，是非常经典的景点。,4.4,2020/08/12,1
633,人好多好拥挤。就记得人多了……不喜欢,4.4,2020/12/01,0
634,青岛栈桥是一个标志性的建筑，很喜欢。,4.4,2020/11/08,0
635,青岛地标建筑，没什么意思，人太多。,4.4,2021/07/09,0
636,走上栈桥可以看到不远处的军事博物馆,4.4,2020/12/24,0
637,还算比较好的经典 可以喂海鸥 景色不错,4.4,2020/12/08,0
638,这儿凉风习习，夜景更美，值得一去。,4.4,2019/08/26,0
639,"时隔多年再见青岛居然是个超强台风日！封海上一切活动！多天吃吃喝喝！终于可以看海踏浪了！天气还是阴沉着脸！好在和海可以亲近一下了！
【景色】
【趣味】
【性价比】",4.4,2019/08/15,2
640,栈桥是青岛的地标之一，打卡必去。,4.4,2020/11/30,0
641,很好很好很好,4.4,2020/10/10,1
642,雨中游栈桥看大海，别有一番风情。,4.4,2020/08/23,0
643,性价比高，总体超赞，景色不错，,4.4,2021/02/02,0
644,这个地方挺漂亮的，也挺干净的。,4.4,2020/12/31,0
645,总体超赞，景色不错，有趣好玩，,4.4,2020/12/11,0
646,非常的不错,4.4,2020/09/25,1
647,带闺女和儿子前来玩耍，风景真好。青岛的标志性建筑物,4.4,2020/08/02,1
648,我去的时间不对，没有看到想象中的景色，人也比较多。不过总体来说还是不错的，也适合拍照打卡，交通也挺方便的，下了高铁，直接步行就到了，公交车也挺方便的。,4.4,2020/04/04,0
649,青岛的栈桥可以说是青岛的地标性建筑之一，重新翻修过的栈桥又换发了青春！,4.4,2020/02/08,0
650,来青岛这几个景点必须打卡 栈桥,4.4,2021/07/16,0
651,冬天，淡季去的人少，不查门票,4.4,2020/12/11,0
652,风景优美，环境贼好，适合散心,4.4,2020/10/15,0
653,傍晚在栈桥旁边吹吹海风很惬意，人也蛮多的，9月中旬去的晚上会有点冷。,4.4,2020/09/22,2
654,特别好看尤其是夜景可以晚上带着女朋友去浪漫的走,4.4,2020/08/13,1
655,栈桥位于市南区，离火车站很近，市青岛地标建筑。,4.4,2020/07/13,1
656,风景不错，进一步拥抱大海，青岛的标志性建筑之一,4.4,2020/06/07,1
657,没问题，好着呢，666。,4.4,2021/01/19,0
658,"青岛打卡景点
听海风的声音",4.4,2020/10/15,0
659,非常棒的地方，人还不多,4.4,2020/12/22,0
660,很美很漂亮，的确很壮观,4.4,2020/10/06,0
661,栈桥是青岛著名景点之一，是著名的网红打卡地,4.4,2020/06/12,1
662,回澜阁，打卡必去，青岛的标志，可以喂海鸥噢,4.4,2020/05/03,1
663,来青岛第1次的时候，下了火车就先去了栈桥，那时候是冬天，还有海鸥，给人一种非常美的感觉。从那以后我就特别喜欢上这个城市，每一次节假日几乎都来。,4.4,2020/03/10,0
664,人山人海的青岛栈桥是我唯一的印象。人一多在好玩的地方也是白搭!,4.4,2020/03/07,0
665,性价比高，有趣好玩，,4.4,2020/10/26,0
666,附近景色还是不错的，比较经济实惠的方法是乘坐观光车绕海边游览,4.4,2020/03/23,0
667,景色不错，就在火车站旁边，是免费景点，不过因为是处于交通枢纽，人流很大，一直走到栈桥里面，亭子一圈可以看海景，我是国庆放假去的，天气不是很好，看不到晴空万里的海天一色，再加上放假人多，可想而知拍的照片到处都是人了。,4.4,2019/06/12,1
668,免费，棒极了，大海沙滩美景，就是风大冷了点，很棒棒呦！两边沿岸的松柏长势喜人，婉约柔美或松劲刚强，姿态各有不同，有供游人小憩的长椅，就是商业做的还不够到位，青岛更应该打造为休闲旅游为主，船舶运输工业为辅的综合性发展城市才好。,4.4,2019/04/24,1
669,作为本地人跟各位分享下，第一青岛的物价确实高，我们自己去市场买海鲜，养殖的最次的虾就是30，好点的竹节虾七八十正常，不过十几个。第二栈桥停车很难，海边限行规则多，建议公交地铁。第三，下海玩可以，海浪大的时候要听话，别靠近，不然就得东海龙宫一生游了，涨潮的速度永远比你想到的快，一定一定要在发现海水上涨时就往回走。跌潮的时间很好记，初一半夜，十五中午，都是农历，赶在跌潮之后的半小时以内上岸，基本不会被困住。第四，海边抓的小螃蟹什么的，建议走的时候放回大海吧，没肉吃，回酒店也不过是让它们在矿泉水瓶里慢慢死去。第五，栈桥附近有海鸥，即便是一月份那种寒冷的天气也有。强行卖海鸥粮食的你不要搭理，直接走人，纠缠只会影响心情。看了好多关于家乡的负面说辞，有的有道理，有的真就是地区差别吧。如果方便的话可以在出发前问问酒店服务员，尤其是保洁，那些都是我们本地人，客客气气问，好好说谢谢，没人会不告诉你。,4.4,2018/08/29,3
670,"栈桥是青岛海滨风景区内的一个标志性景点，与青岛市区繁华的商业街——中山路相连，并直接伸入海中400多米，当海轮驶入青岛港时，首先应如眼帘的便是这座青岛的标志——栈桥。 陆路进入由于景点免费，桥上经常人满为患。漫步栈桥之上，可尽收青岛湾的如画美景，簇簇雪白浪花、点点赤色礁岩，红瓦绿树点缀于海港之滨，飞阁回澜安坐于碧波之上，百年沧桑，终现生机勃勃。
退潮时可遇到很多赶海的人，拎着小桶还拿着工具，捡拾小蟹、贝壳之类的海产。",4.4,2017/01/10,3
671,不需要门票，完全开放式的。因为住在如家酒店，早晚散步都可以去，看到晚上如梦似幻的灯光下的栈桥，清晨云雾迷蒙的栈桥，中午潮水退去，海边捡贝壳的海蟹的人群，不同的感觉，比跟着旅行团走马观花确实不同。建议自助游，可以深刻感受,4.4,2015/10/23,7
672,晚上去的，大家都在举着手电筒🔦挖螃蟹和海螺🐚吧，适合爸爸带孩子玩有趣好玩，,4.4,2020/08/29,1
673,还差不多吧！与想象的差不多。坐了坐快艇,4.4,2020/08/19,1
674,栈桥在海的中央，可以直接看到大海很漂亮,4.4,2020/04/29,1
675,随便转转，也没啥,4.4,2020/12/30,0
676,景点比较单调了，人还特别多，可能是标志性建筑物吧，海景还是很开阔的景色不错，,4.4,2020/10/06,1
677,免费的不用预约了,4.4,2020/08/21,0
678,景色优美，环境也不错，总体来说还可以,4.4,2020/07/03,1
679,是青岛旅游必去的打卡景点，吹吹风吃个小吃，感觉非常不错。,4.4,2020/03/17,0
680,值得一游，景色美极了，看着大海，吹着海风，让人思绪万千。,4.4,2020/03/01,0
681,风景还是不错的，就是人有点多，没有地方停车，建议坐公交去,4.4,2020/01/03,0
682,青岛的标志性建筑和必游景点之一，离火车站不远，多条公交线路到达，交通方便。风景优美空气清新，还有有游艇，摩托艇等娱乐项目。栈桥是免费游览的，是留影的好去处。,4.4,2018/09/19,1
683,坑，全是拉坐船的，不做还不能停车，要走好远还是地下停车场，又臭又乱！穷疯了,4.4,2021/07/05,1
684,风景不错，很好,4.4,2020/08/31,0
685,环境幽雅，空气清新，整体感觉还不错,4.4,2020/07/03,1
686,还挺推荐去的,4.4,2020/12/08,0
687,不错的地方，旁边就是海军博物馆。,4.4,2020/08/06,1
688,就在青岛火车站南边不远处，很好找,4.4,2020/07/27,1
689,比较受外地人欢迎，看海还是不错的,4.4,2020/06/13,1
690,青岛标志建筑，每次来都到这了里。,4.4,2020/05/28,1
691,每次去青岛必须要打卡的地方，栈桥,4.4,2020/05/11,1
692,春桃花开之际，面朝大海春暖花开！,4.4,2020/04/30,1
693,一架见证了历史风雨的海上栈道，如长龙入海，观景之美！,4.4,2019/12/21,0
694,不错不错好,4.4,2021/01/22,0
695,青岛标志性的地标，每天人很多。,4.4,2020/08/06,1
696,无需门票，在海边玩，可以干海，,4.4,2020/07/25,1
697,在栈桥上喂鸽子，非常不错的啊。,4.4,2020/06/22,1
698,栈桥很漂亮，在海上，风景优美。,4.4,2020/06/11,1
699,网红景点，退潮了可以去捡螃蟹。,4.4,2020/06/03,1
700,伸入海中的栈桥，终端有个亭子，吹吹风看看海，不错呦,4.4,2020/02/19,0
701,这个球跑步成了青岛的一个标志性的建筑，来到青岛必须要看一下，他像一条长龙一样一直伸展到海里，尤其冬天的时候，上面有很多海鸥可以在这里喂一喂，特别的好。,4.4,2019/09/10,1
702,青岛站出去，走几百米就是栈桥了，很美的一座城市！景色不错，体验很好，,4.4,2020/08/13,1
703,青岛标志，打卡热点，虽然不好玩，还是值得走走逛逛,4.4,2020/01/19,0
704,栈桥是青岛的一大景观，人很多，我很喜欢这个景点,4.4,2020/04/15,0
705,值得一游，景色宜人，看着大海，让人流连忘返。,4.4,2020/03/01,0
706,百来不厌的地方，栈道入海，体验海之宽阔美！,4.4,2020/03/06,0
707,一个美丽的地方，白色的海鸥就在你旁边飞舞。,4.4,2020/03/02,0
708,很不错的地方，去青岛必去景点，就是人太多了,4.4,2019/12/23,0
709,青岛栈桥始建于清光绪十八年(1892年)，是青岛最早的军事专用人工码头建筑，现在是青岛的重要标志性建筑物和著名风景游览点，青岛栈桥全长440米，宽8米，钢混结构。,4.4,2018/11/02,0
710,大家都会认为青岛夏天好玩其实这次圣诞节为了看海鸥专门去的，每年入秋以后候鸟南飞的时候是看候鸟最好的时候，没事还可以买点油条喂喂海鸥，值得一去。,4.4,2018/09/02,1
711,【景色】这里蛮好的呀，很喜欢的一个地方哦,4.4,2020/07/10,0
712,人多的打卡景点，但是没觉得有什么好看的啊,4.4,2020/02/23,0
713,栈桥的景色就是好看，在海上，就是人有点多,4.4,2020/01/12,0
714,来到山东就要到青岛，到了青岛就要来栈桥，在这里你可以欣赏到美丽的风景，而且闭上眼睛还能感受清风吹过去的时候的美妙的感觉。,4.4,2019/11/15,0
715,02年第一次去青岛时是从北京坐火车直达现在离青岛著名景观很近的青岛老火车站，出了火车站走几步就是栈桥，哟记得当时是冬天，尽管这样海滨依然人满为患，并且有组织冬泳活动的在海边进行，那时的青岛栈桥海边全是海鲜大排档，没有现在这么斯文,4.4,2019/06/19,0
716,"♬♬ 91[%]以上的外地游客不知道，冬季成群的海鸥盘旋时，是栈桥异常美丽的时刻

栈桥作为青岛的标志和名片，是很多人必来打卡游览的地方，很多人会选在夏季来到青岛、夏季的青岛可以随意下海，但人太多、密密麻麻地像在下饺子！

如果想要领略栈桥的另一种美丽，可以在3-4月份来玩，上万只海鸥停留在栈桥周围，场面相当震撼！

沿着栈桥的海岸线漫步，可以步行到达很多美丽的景点：栈桥出来中山路，是青岛的老城区，天主教堂，往东边走八大关，海底世界。

栈桥是青岛最早的军事专用人工码头，是青岛标志性建筑和著名风景游览点。南端防波堤内部的八角楼被称为“回澜阁”。伫足于此，可以欣赏到青岛十景之一“飞阁回澜”的震撼场面。北侧沿岸被称为“栈桥公园”，园内花草郁郁葱葱。",4.4,2018/09/13,0
717,栈桥是青岛的重要标志性建筑物和著名风景游览点之一，位于中山路南端，桥身从海岸探入弯月般的青岛湾深处。桥身供游人参观并停靠旅游船，由此乘船可看海上青岛。青岛栈桥南端筑半圆形防波堤，堤内建有民族形式的两层八角楼，名“回澜阁”，“飞阁回澜”被誉为“青岛十景”之一。这里是免费景点，有多路公交到达。,4.4,2016/08/19,11
718,"缓缓踏上一条440米长的海上长廊，四周水天相接，烟波浩渺，潮起则乱石崩云，惊涛裂岸，卷起千堆雪，引无数游人竞折腰；潮落则赭色岩礁、金色沙滩均露出水面，引一众游客赶海拾贝。
尽头则是一座双层飞檐八角亭阁，名为“回澜阁”，亦即遐迩闻名的青岛十景之一“飞阁回澜”，栈桥似长虹卧波，回澜阁熠熠生辉，山、海、城、景浑然一体，一派“红瓦绿树，碧海蓝天”的迷人风光。",4.4,2016/06/19,22
719,青岛栈桥位于游人如织的中山路南端，桥身从海岸探入弯月般的青岛湾深处。青岛栈桥是青岛海滨风景区的景点之一，是国务院1982年首批公布的国家级风景名胜区，也是首批4A级国家旅游区。青岛栈桥由回澜阁、小青岛、中山路、海水浴场等景点组成。青岛栈桥始建于清光绪十八年（1892年），是青岛最早的军事专用人工码头建筑，现是青岛的重要标志性建筑物和著名风景游览点。,4.4,2016/04/08,37
