,评论,得分,时间,点赞
2112,到青岛第一个接触的沙滩，有礁石，人很多，风景真的很美，周围好多游艇。就是天气不给力，冷的我以为是秋天。,4.4,2015/06/07,0
2113,青岛的标志性景点，现在海边看人影繁杂，海水泛波，游艇飞驰，四周繁华景色，对青岛的感觉立即犹如神来之手。,4.4,2015/05/24,0
2114,栈桥是青岛最有名的景点没有门票就是一个延伸到海里一个很长的桥虽然一般到是去那里旅游的人很多因为他的名气,4.4,2015/02/24,0
2115,一个人走走，天气晴朗，人也不是很多，风有点冷，但是冬日里很安详,4.4,2015/02/12,0
2116,栈桥，建于光绪年间，已有百年历史，是一条440米长的海上走廊，从海中，一直以来被视为青岛的象征，栈桥曾是青岛最早的军事专用人工码头，站在桥上向东望去，还可以看到一艘舰船和一艘潜艇。,4.4,2018/08/21,0
2117,去了很多次栈桥，感觉也就无所谓了，回澜阁可以进去看一看青岛的历史，早上去的话，可以看见很多海鸥觅食，当地的专门在栈桥摄影的人喊一嗓子，海鸥就跟能听懂样，老远就能成群结队的飞过来，把海鸥食一扔，海鸥就能边飞边吃！真的很不错！,4.4,2018/02/08,1
2118,越靠近海边越兴奋，我是白天去的，栈桥上全是人从众……海风很大很舒服，天蓝蓝海蓝蓝水天一色，趴在栏杆上看海很好，但是栈桥底下坐快艇坐船骑水上摩托的就不是很建议了，就是把你带到附近海面的一个点就回去了，如果想时间长一点又要加钱，而且态度也不好，极差，花钱买个孙子，毕竟人家一天都收十几几十万的，根本看不起游客,4.4,2017/08/31,3
2119,栈桥还不错的，青岛啤酒的标志回澜阁就在这，门票挺便宜的就20，不过也没什么好玩的。里面还卖当地的工艺品，小玩意。傍晚的时候还可以在海边捉捉小螃蟹，一个个的都在石头下面，捉了好多，第二天起来一看全死了，儿子还有点伤心,4.4,2017/07/23,1
2120,真心一般，唯一感觉壮观的就是进入青岛时候的胶州湾跨海大桥真的太美了，至于这个栈桥个人感觉1.带孩子一定要注意安全周边护栏很简陋，2、白天真的没有什么好看的，晚上也就是拍个照片乘乘凉，而且跟前的沙滩也很小多数是礁石堆，海底世界后面的才有一片大沙滩，个人觉得太商业化没有海边那种调调从栈桥上看你可以说它是海也可以说它是一个河塘！,4.4,2017/07/17,1
2121,栈桥去过好几次了，每次都有不同的感觉，夏天去的时候感觉凉爽清新，吹吹海风感觉很棒，海鸥成群结队，自由自在的飞翔，可以提前预备一些海鸥饲料，喂海鸥的过程很有趣，冬天去海风比较刺骨，但是冬天的海也是别有一番风味的，有时间了大家可以自己去体验一下！,4.4,2017/01/23,1
2122,栈桥，中山路南端，来青岛必来景点之一，深入到海里的一条木栈道，尽头是回澜亭，漫步木栈道，可以买到各色贝壳小纪念品，还可以在这坐船观海上青岛。,4.4,2016/12/13,2
2123,我们来的季节是最好的时候，很多的海鸟在青岛栈桥海域，它们时而成群结队低空飞翔，场面壮观；时而漂浮在水面稍作休息，给我们这些摄影爱好者“摆POSE”；时而飞近岸边，瞄准游客扔出的食物作出一个俯冲……海鸥飞翔是栈桥不错的风景。,4.4,2016/12/13,1
2124,栈桥是青岛标志之一，这么多年，无数人，人来人往，都曾在上面走过，桥面也断过几次。实际上桥本人没什么好看的，大家应该比较西关在桥上走的感觉。尽头的回澜阁像是个小型博物馆，又像卖东西的。。。楼梯很窄。。有点吓人,4.4,2016/10/23,1
2125,青岛的地标建筑，长度400多米，建成已100多年，与老城区的欧式建筑特别与对面的小青岛相映成趣，满潮时走在上面，四周全是海水像深入海的中央，清澈湛蓝的海水哪吗诱人，想畅游其中。退朝时，周边的海滩礁石，有小鱼小虾螃蟹蛤蜊蛏子等海货，特别时带上孩子共同参与非常有趣。最重要的这么好的景点是免费的。冬天上万只海鸥栖息在栈桥，喂食时群鸥飞翔巍巍壮观！,4.4,2016/10/17,1
2126,这是青岛城市发展的发源地，虽然在我们看来不过是一条伸入海的栈道，但它承载着这个海滨城市的过去和未来，记述着这个城市的变迁。在回澜阁，前望时，茫茫海水，风起波涌；回望时，华灯初上，一派繁荣景象。也许此刻，你心里想念的是那个曾经的她（他）。,4.4,2016/09/30,1
2127,这里有好多的海鸥，还可以这里抓螃蟹找小贝壳，我上次去还做船了才50元一个人呢，很刺激很好玩哦，带上你心爱的他一起去看看吧,4.4,2016/08/25,1
2128,栈桥如果没了解栈桥到历史！其实就是一座延伸到海中的一座桥！去的人很多！我们也是在人群中走了一回！没感受过大海的人可以在这看到一望无际的大海！感受一下海风拂面！栈桥旁边有一个浴场好像是第五浴场！但是如果你能受得了你在一堆垃圾里游泳的话你可以去海里感受一下！,4.4,2016/08/17,1
2129,栈桥青岛地标建筑，离火车站很近，走着就能过去，当天去的时候人很多，没到桥上面，只是从远处拍了张照片，海天一色还是很美的！,4.4,2016/08/13,1
2130,去的时候虽然是阴天 但是那种大海的静谧 让人心情无比舒畅 绝对满分,4.4,2016/04/06,0
2131,从小就对大海情有独钟，青岛去过好多次了，每次都会去栈桥，喜欢听那里的海浪声，喜欢吃那里的海鲜，更喜欢坐船出海的感觉，真的是很美的一个地方，晚上更美，如果出去散心，栈桥最合适不过了。,4.4,2016/03/30,2
2132,吃海鲜，价廉物美，北方人的菜就是量大价格实惠，一百多块钱还包括啤酒，点了好多盆海鲜，个人觉得小海鲜比大海鲜好吃，就这样清水煮煮味道也是极好的,4.4,2015/10/24,0
2133,人很多，免费景点，随便看看，凑热闹而已！有乘快艇的阶梯可下去,4.4,2015/10/03,0
2134,栈桥是青岛的象征，素有“长虹远引”之美誉，而且俗称前海栈桥！,4.4,2015/09/14,0
2135,人超级多，可能因为暑假！不过蛮美的，下次有时间还去，带孩子去,4.4,2015/08/05,0
2136,青岛栈桥是青岛的奢名景点，也是中外游客去青岛游览的必到之处。栈桥全长440米，宽8米，桥南端建有回澜阁等建筑。游人伫回澜阁旁，可以欣赏到蔚蓝无际的大海的景色和层层巨浪涌来感觉。被文人总结为飞阁回澜，被誉为青岛十大景之一。,4.4,2015/03/31,1
2137,青岛的著名景点，我们是下午去的，那叫一个人多啊。还有报地图什么的。还可以乘船去于，是照相的好景点。时不时能看到海鸥飞过，是到青岛必去的地方。,4.4,2014/09/11,2
2138,没什么好看的，个人感觉。不过海边有卖贝壳的，晃晃悠悠走还行,4.4,2019/06/18,0
2139,栈桥是一个历史古迹，去的时候人太多，配上海景还是很漂亮的。,4.4,2018/10/07,0
2140,虽然沙滩不细 但是孩子们在礁石里抓螃蟹抓鱼不亦乐乎 离车站近 走一会就到 住在车站附近的酒店出来玩 非常方便,4.4,2018/08/18,0
2141,青岛比较出名的建筑了，这里边冬天感觉来的时候比较好，可以看看海鸥，夏天来的时候人太多了，尤其是旅游旺季的时候，根本看不到景色，都是人挤人。,4.4,2017/11/23,2
2142,就在火车站旁边，值得一看，就是人很多。,4.4,2017/08/11,1
2143,栈桥是免费得，有重要的历史地位，要说好玩，也不见得，但毕竟是青岛游玩必去的地方，栈桥还是很热闹的。栈桥上的回澜阁是有时间限制的，具体几点我忘了，去迟就关门了。,4.4,2017/07/08,1
2144,风景很美，4月初人不是很多，坐的一趟快艇，坐之前说好多景点得玩40分钟，坐了之后才发现几分钟就完了,4.4,2017/04/06,2
2145,栈桥的旁边有一家咖啡馆，coffeebene，栈桥的人很多，环境十分嘈杂，但是在咖啡馆里，是难得的一方净土，与窗外的景色交相辉映相得益彰。,4.4,2016/12/20,2
2146,晚上去的栈桥，12月份的夜晚还是很冷的，风很大，人很少，估计本地人不会这个时候来的，真心很冷，海的味道很好闻，夜晚洄澜阁的灯亮了，真心很美,4.4,2016/12/05,2
2147,栈桥始建于1894年，全厂800余米，桥南端建有两层八角的楼阁，称回澜阁，是青岛市的标志性建筑，这个景点是不收费的，有兴趣可以去参观一下。,4.4,2016/11/15,2
2148,没有门票，在中山路附近，中山路有很多好吃的，去过两次栈桥，两次都是在中山路的民国饺子楼吃的饭，感觉比较正，至于栈桥没有什么特别值得提的地方,4.4,2016/10/04,2
2149,吃完晚饭去最合适，既可以下海游泳也可以挖沙赶海抓小螃蟹，也可以就是吹吹海风，纳凉赏海。越晚人越多，7点后会亮灯，不收门票，离火车站10分钟的路程，不错的景点。,4.4,2016/08/19,3
2150,当年爸爸和妈妈座火车到青岛目的地是前往烟台海军工程学院看望在那里当兵的弟弟，在青岛短暂停留了一天，我们一同去栈桥景点看了看。这是我第一次见到大海，心情就像大海一样的澎湃，很高兴。,4.4,2016/08/06,2
2151,棧橋是青島的標誌性景點，由廊橋和亭台構成，形似一把提琴，镶嵌在碧海邊，與小青島遙遙相對，呼應著紅瓦綠樹碧海藍天的島城，故此青島亦名曰琴島。,4.4,2015/11/09,0
2152,"很漂亮，去的那天天气不错，
下海玩了会，第一次吃到海水好咸",4.4,2015/10/08,0
2153,挺漂亮的可以看到整个海湾的风景，特别是沿海一代，也不用花钱,4.4,2015/09/26,0
2154,很不错的地方！如果是情侣的话很值得去！走在栈桥上迈着悠悠的步伐很是一番情调！而且周围景色优美空气清新！还有古建筑！站在上面心情就豁然开朗！,4.4,2015/09/17,0
2155,吹海风，捉螃蟹，泡泡脚。很好。离火车站很近，下车就可以去。,4.4,2015/09/06,0
2156,去看看，吹吹海风，挺好的！免费的，过去看看，晚上比较舒服。,4.4,2015/09/05,0
2157,青岛海边景色 还是漂亮迷人的 记得去的时候 温度不是很高 游人不多,4.4,2015/07/10,0
2158,青岛气候不错，四月份去中山公园看樱花，特别漂亮，海风 海鸥，比较喜欢沿海城市，特别喜欢旅游，青岛的小吃特别多，海鲜特别划算，新鲜，棒棒哒！,4.4,2018/03/10,2
2159,栈桥还是值得去的，就是高峰期人太多了,4.4,2017/07/29,1
2160,我去的时候，大概是旺季。人流较大。所以没怎么拍照，海很美。建议真心淡季去比较好。沿着海边走走，何不美哉。还能在沙滩边玩玩沙，掏掏小鱼小蟹,4.4,2017/01/03,2
2161,值得去的地方，干净漂亮，特别是黄昏时的晚霞映衬下太美了。我用的手机拍，效果没有实地好，大家将就看,4.4,2016/11/29,0
2162,国庆期间人真是好多，栈桥也算是青岛比较有名的景点，扎堆的人在那挖沙玩海水，还有很多拍结婚照的新人。桥直接深入到青岛湾，一路走进去可以看到整个海域，全长也不是很长，走走看看很不错,4.4,2016/10/07,2
2163,可以看到青岛全貌的好地方，又不收门票，也可以在海滩上玩沙～在礁石群里翻翻，运气好的话有可能会翻到沙蟹～贝壳之类的，对于不是在海边生活的人来讲，也是很有乐趣了,4.4,2016/10/06,3
2164,有的时候可以看见海鸥，，海风吹着特别舒服。适合跟父母，家人一起旅行的地方，附近吃饭也很方便，离教堂也近走着就能到达，不错，推荐可以去看看,4.4,2016/07/21,2
2165,栈桥，吹着海风，找找小螃蟹，喂喂小海鸥，别有一番趣味⋯⋯,4.4,2016/04/30,0
2166,当然所有到青岛的朋友都会去，不是吗？免费，风景宜人，够了,4.4,2015/12/04,0
2167,景色非常漂亮，而且景点是免费的但是那里的停车的停车场很乱，建议不要开车过去玩儿，景点非常的出名是青岛的标志性旅游景点，来青岛一定要去的。,4.4,2015/12/03,0
2168,夜晚的栈桥更美！美中不足就是乞讨太多，一个比一个可怜兮兮，哎咋这么多残疾人！青岛政府不管他们吗？,4.4,2014/11/07,0
2169,风景其实一般，名气比实际响，住在海景房，所有景色尽收眼底,4.4,2014/09/26,0
2170,青岛的标志，虽然趣味差一些，但是周边风景还不错，看看我的照片，满沙滩的人，真有一只螃蟹，我估计旁边可能有几个人等着。,4.4,2014/06/07,3
2171,"不逛下,总少了点什么,脸基尼不少|",4.4,2019/07/16,1
2172,强烈推荐傍晚或者天气不好的时候去，可以拍到不一样的风景,4.4,2019/06/24,0
2173,青岛的著名景点，一条栈道修道海里，来旅游观光的人很多，很热闹，旁边有沙滩，很多人都在玩水，看大海，拍照，热闹非凡，景色优美，美如画卷。,4.4,2017/10/03,2
2174,真是一年四季都去过，栈桥了，每次去人特别多，而且每次都想在桥上走一走，心情特别好，尤其是冬天，人少的时候有海鸥，桥边上一走很有意境的。,4.4,2017/09/25,2
2175,栈桥，是青岛的著名景点之一，离火车站很近，可以跟周围几个景点一起游玩。去栈桥等人很多，建议早一点去，不管是拍照还是在海边都会比较惬意。,4.4,2017/07/24,2
2176,闲暇时间去看看，确有一番风情。觉得更适合学生情侣们周末随便走走逛逛。海风吹着，私话聊着，还有海鸥，再听着民谣，再多烦心事都会抛之脑后。,4.4,2017/02/13,2
2177,阳光、沙滩、海浪、栈桥、高楼、海鸥连成一片，海天一色。去的时候是旅游淡季，人不太多，这里没有门票，距离青岛火车站也很近，真的值得一去。,4.4,2016/10/27,2
2178,门票免费，远观可以看到大皇宫，很辉煌，来青岛必去的景点,4.4,2016/10/06,0
2179,看海景不错，尤其对于内陆的游客，蓝天大海，一路走一路吹着海风，可以沿着木栈道一直走到第一海水浴场，如果愿意可以一直走到五四广场，哈哈！,4.4,2016/08/09,2
2180,个人感觉一般，不过作为青岛的标志建筑还是可以去看看的。中间的亭子是可以上去的，但旺季去人很多，要排队的。这样的景点也就是过去遛一遛而已,4.4,2016/08/02,2
2181,白天没来得及。看了夜景。海风吹来阵阵腥味。略有点吃不消,4.4,2016/07/05,0
2182,这里有美丽的海鸥，有辽阔的大海，还有快艇轮船，景色优美，不过要注意去时带个褂子，毕竟海边有些冷,4.4,2016/02/23,0
2183,就一条路到海里，也没啥，不过人挺多的，看到大海真心不错,4.4,2015/10/27,0
2184,青岛著名景点！晚上去的人不多！但景色不错！灯光效果好!,4.4,2015/10/08,0
2185,去青岛一定要去栈桥 离火车站也近 推荐拿出半天时间 那个小寺一定要上去 门票才4元 也不贵 楼上有寄名信片的地方 海上自行车和摩托艇推荐 还是很便宜的,4.4,2015/09/09,0
2186,去青岛才回来，行程太紧张，基本就是一直在路上，就没有哪个景点能玩的尽兴的，人还多，以后再也不在暑假期间出去旅游了，到处都是人，干什么都排队，能看的景点都是人头，还要比谁身体好,4.4,2015/07/25,0
2187,从八大关走过来的，沿途风光不错。但是栈桥本身很一般。,4.4,2019/05/23,0
2188,这是个人多到4G频段都能分配完的地方，节假日谨慎前往,4.4,2019/04/29,0
2189,青岛的地标建筑，人非常多而美的。,4.4,2019/03/12,1
2190,青岛象征的地方，玩过后建议去黄岛金沙滩，还有竹盆岛。,4.4,2017/08/31,2
2191,以前是青岛的标志，全国闻名，现在不像是以前那么热门了，不过人还是那么多。,4.4,2017/08/30,1
2192,这个地方排了长长的队，都是为了照相，行程紧的就远距离照张相就行了，排队要等好长时间。远距离也可以观赏到栈桥的景色，我就是在海边照的。,4.4,2017/07/28,2
2193,虽然是标志性景点，但是实在是太脏，晚上去的，都能看到沿岸海面飘着许多垃圾，胜在交通方便又免费,4.4,2017/07/03,0
2194,因为有个回澜阁，又是青岛最有代表性的景点，所以，几乎所有的游客都会去走一圈，海边看看海！吹吹海风！离中山路步行街和青岛火车站都很近！,4.4,2017/05/31,0
2195,很值得一去，离青岛老火车站很近，风光很好，跟海鸥近距离接触，很棒!由于是淡季去的，人不多，能更加体会到大海的美丽，真有点乐不思蜀了。,4.4,2017/03/14,0
2196,栈桥风景不错，在这里可以遥望海军博物馆的105舰。这里特别适合亲子活动，退潮后的沙滩上可以玩挖沙，浅滩上可以抓到小鱼、小虾和小螃蟹。,4.4,2016/10/06,4
2197,海边景色很漂亮，海风吹着特舒服！,4.4,2016/08/30,3
2198,不要门票，必去景点之一。旅游的人比较多，赶上暑期了。景色真的很美，栈桥一直延伸到海里，桥上的人比较多，最好靠中间走，因为宝宝怕掉海里,4.4,2016/08/17,2
2199,挺不错的，感觉风景非常好，值得一去。栈桥是青岛的一个非常古老的景点，有着长的历史，并且景点旅游费用低，周边出行方便，距离其他景点近。,4.4,2016/07/24,2
2200,人流量一直都很大多，实际上也没什么好看的，天天看。。,4.4,2016/06/01,0
2201,栈桥很美，回澜阁修缮中。火车站门前正在施工，穿过地下通道，一上来，就能看见海边。海边很干净。,4.4,2016/04/26,0
2202,风景很好，是个怀念的好地方，冬天太冷，要是夏天就好了,4.4,2016/01/15,0
2203,这个值得去看看，几乎免费的，就是停车时，停错了要20元一小时。隔别正规停车才10元一小时。还好就停留了1个小时。这些人给青岛抹黑了。,4.4,2015/08/31,0
2204,人很多但是挺好玩的，靠近火车站，很多好吃的还可以游泳,4.4,2015/08/14,0
2205,真心的很漂亮、下午和老公去就喜欢上那里、就是人很多。,4.4,2015/07/24,0
2206,必须要来的地方、就是人太多太多、乞讨的人影响城市形象,4.4,2015/07/01,0
2207,看到很多人喂海鸥，景色还好，拍照的好地方，值得一去。,4.4,2015/02/25,0
2208,可以沿着桥走至海深处，尽头一览无边的大海，景色很美,4.4,2018/11/03,0
2209,栈桥免费参观，人很多，周边的海滩上很多人在赶海拾贝，很有意思，周边的海水非常清澈！在这里可以看到不远处的军舰和潜艇！非常好的景点！,4.4,2017/07/23,2
2210,挺好的，人辣么多 推荐来逛逛玩啊,4.4,2017/04/19,1
2211,其实栈桥没有网上看到的那么美因为都是人，不管你那个角度拍人都是有的，除了人多就是人多，毕竟路过那就去看看喽，拍了一些照片仅供参考！,4.4,2017/03/31,2
2212,漂亮很好，风景如画，值得一去。,4.4,2017/03/27,1
2213,青岛地标人很多周边环境也很不错篮篮天空白白云再加上蓝篮一望无际的大海这风景绝对是迷人夏天吹吹海风海堤边悠哉地走走聊聊天绝对是一流的,4.4,2017/03/03,2
2214,只能说黄金周这里是人山人海啊。桥上毫无立足之地，桥下海滩人比蛤蜊还多，全是人，这里风景也确实漂亮，毕竟这里是青岛的标志，值得一看。,4.4,2017/01/26,2
2215,晚上去的，因为住的地方离那里比较近。路边有一些明国建筑。晚上在那里的人不是很多，那里比较黑，一个人不推荐晚上去。晚上海水拍打礁石声音可以用“巨”形容。专心听久了会有点怕。,4.4,2017/01/22,2
2216,钱可花多花少，自己掌握，实惠!,4.4,2016/10/05,1
2217,各位自驾游的一定找找地方停车再过来！停车地方太难找了！最好是在离这里1公里处找停车的地方，开进来基本是转圈！我们来的时候还是下雨！,4.4,2016/10/02,2
2218,非常值得去看看，尤其早晨和傍晚，一般不要选择节假日过去，人太多了，感受不到景色的韵味，静静地去品味，才能体会古老的栈桥讲给的历史。,4.4,2016/09/28,2
2219,去青岛玩肯定去栈桥啦，已经成为标杆性的活动了，不去的话就跟到了北京不去长城一个样子的，栈桥旁边可以捡贝壳，逛逛街，风景还是蛮不错的,4.4,2016/09/23,2
2220,青岛栈桥真心不错，悠久的历史，古老的文化，值得一去,4.4,2016/08/23,2
2221,值得去。晚景不错。海风很舒服。还可以捉小蟹什么的。,4.4,2016/08/19,2
2222,值得一看，我是每年去一次，使得我们流连忘返。顺便还可以看看五四广场、石老人海水浴场、海底世界，还有去黄岛金沙滩玩儿，走进海底隧道。,4.4,2016/07/24,2
2223,海关大厦，海上皇宫，栈桥，军舰都在附近一天基本都可以玩了，离青岛火车站也特别近，可以在栈桥买好多小礼品回去给亲戚朋友带，值得一去。,4.4,2016/07/23,2
2224,此景点以经是一个概念性的了，没有任何体点，想看海的人可以去看看，除了看海就没有别的了，中山路里破旧不堪，人车不分流，去了准后悔啊！,4.4,2016/07/12,2
2225,刚刚维修焕然一新的青岛栈桥，周边波涛汹涌，海鸥绕飞，仿佛在碧海蓝天之间架设了一架天梯，远处看去，行走在栈桥上的人们犹如进入仙境……,4.4,2016/06/15,0
2226,值得一去的好地方，海鸥不怕生，不用花钱，性价比超高，住在对面的酒店，打开窗户就能看到大海！,4.4,2016/02/09,2
2227,一出火車站，往前走不遠就能看到棧橋，漫步棧橋要是時間趕得巧還能看到成群結隊的海鷗，帶上麵包片餵餵海鷗，聽聽潮聲，看看海浪，很愜意。,4.4,2015/09/08,0
2228,有机会还会去的，崂山没上去有点遗憾。城市环境不错。,4.4,2015/09/06,0
2229,很美，就是人太多，海山一色，蓝天碧海楼阁尽保眼底。,4.4,2015/09/04,0
2230,从清晨七点不到至晚上十点，栈桥上永远都是游人如织。,4.4,2015/08/21,0
2231,估计栈桥每天都是人很多啊，青岛的地标。所以大家都去玩。去的时候下小雨，喂海鸥的人也很多。走路走的累啊，不过每次青岛我还是要去看的。,4.4,2015/04/01,0
2232,栈桥是青岛的标志，青岛啤酒的商标标志就有栈桥这个因素，离着火车站很近很近，退潮时，桥面显得高一些，涨潮时，桥面就几乎和海水一样平了。去青岛，必去栈桥。,4.4,2014/12/24,1
2233,栈桥不要收门票。景色很好，十月份去也不太冷，反而很热，太阳很大，但是挡不住络绎不绝的人群。,4.4,2014/10/26,0
2234,在栈桥拍青岛湾是灰常漂亮啦。还可以喂海鸥。很有意思,4.4,2014/10/02,0
2235,很好看的景点 住在对面宾馆 早上起来就 到海边散步 很好,4.4,2019/08/04,0
2236,风景优美的海边景观 性价比很好 海边观光旅游景点之一,4.4,2019/07/10,0
2237,栈桥，青岛的标志，美丽的风景，清澈的海水....,4.4,2018/06/15,0
2238,远看栈桥真的是特别漂亮，青岛这个城市是我最喜欢的一个海边城市，青岛感觉是特别有安全感的一个城市，环境也特别好，当地人都比较文明。,4.4,2017/10/27,2
2239,青岛著名景点，青岛必去景点，回澜阁开放到下午四点半，周边去哪里都非常方便，看日落的好地方，大家一定要去看看，值得一去。希望有帮助,4.4,2017/10/21,2
2240,青岛有名的景色，岸边都有很多海产工艺品，几十到上百的都有，要学会砍价哦，一般买的多的话，店家都会便宜些。栈桥很有历史，值得一看！,4.4,2016/12/16,2
2241,白天和夜晚都值得一去，吹吹海风，看看夜景，都很美,4.4,2016/10/07,0
2242,栈桥是青岛的标志性景点，每次来都喜欢去上面走走，在海天之间徜徉别有一番风景，值得一去看看，是个开放的免费景点，桥的尽头是迴澜阁。,4.4,2016/09/28,2
2243,栈桥是免费游览的，这里既可以看到海上风景，又可以领略青岛风光。是个不错的地方。桥上还有很多可以拍照留念的地方，也不贵。我觉得很好,4.4,2016/08/23,2
2244,去青岛怎么可能不去栈桥，刚看见大海，心胸一下开阔了许多，值得一去。栈桥水不是很干净，但在石头缝里可以抓到螃蟹，孩子还是很激动的。,4.4,2016/07/16,2
2245,青岛栈桥，历史久远，到青岛旅游的人，没有不去走走的。栈桥已经经过返修，走到桥头，似乎到了海中，向正东观望，还可以看到迷人的小青岛,4.4,2015/12/31,0
2246,栈桥，青岛的象征，我去的很少，不过可以远眺。附近的中山路、广西路，有许多老建筑，值得一走。八大关更值得一去，在春天和秋天去最好。,4.4,2015/12/02,0
2247,定的酒店刚好阳台望出去就是栈桥海边，就在火车站边上，因为去的时候天开始慢慢凉了，所以没能跟大海有过多的接触，但是游客还是不少的。,4.4,2015/11/23,2
2248,栈桥算是青岛的标志，远景很漂亮，碧海蓝天，很美。,4.4,2015/09/19,0
